{
  "schema": 1,
  "domain": "professions",
  "family": "canonical",
  "templates": {},
  "entries": [
    {
      "profession_id": "archer",
      "display_name": "弓箭手",
      "description": "围绕中远距离点杀、牵制和区域火力展开的远程职业。",
      "max_rank": 5,
      "hit_die_sides": 8,
      "bab_progression": "full",
      "is_initial_profession": true,
      "unlock_knowledge_id": "",
      "unlock_requirement": {
        "required_skill_ids": [],
        "required_tag_rules": [
          {
            "tag": "archer",
            "count": 2,
            "skill_state": "learned",
            "origin_filter": "unmerged_only",
            "selection_role": "qualifier"
          },
          {
            "tag": "archer",
            "count": 1,
            "skill_state": "core_qualified",
            "origin_filter": "unmerged_only",
            "selection_role": "assigned_core"
          }
        ],
        "required_profession_ranks": [],
        "required_attribute_rules": [],
        "required_reputation_rules": [],
        "assigned_core_must_be_subset_of_qualifiers": true
      },
      "rank_requirements": [
        {
          "target_rank": 2,
          "required_tag_rules": [
            {
              "tag": "archer",
              "count": 2,
              "skill_state": "core_qualified",
              "origin_filter": "unmerged_only",
              "selection_role": "assigned_core"
            }
          ],
          "required_profession_ranks": [],
          "required_attribute_rules": [],
          "required_reputation_rules": []
        },
        {
          "target_rank": 3,
          "required_tag_rules": [
            {
              "tag": "archer",
              "count": 2,
              "skill_state": "core_qualified",
              "origin_filter": "unmerged_only",
              "selection_role": "assigned_core"
            }
          ],
          "required_profession_ranks": [],
          "required_attribute_rules": [],
          "required_reputation_rules": []
        },
        {
          "target_rank": 4,
          "required_tag_rules": [
            {
              "tag": "archer",
              "count": 3,
              "skill_state": "core_qualified",
              "origin_filter": "unmerged_only",
              "selection_role": "assigned_core"
            }
          ],
          "required_profession_ranks": [],
          "required_attribute_rules": [],
          "required_reputation_rules": []
        },
        {
          "target_rank": 5,
          "required_tag_rules": [
            {
              "tag": "archer",
              "count": 3,
              "skill_state": "core_qualified",
              "origin_filter": "unmerged_only",
              "selection_role": "assigned_core"
            }
          ],
          "required_profession_ranks": [],
          "required_attribute_rules": [],
          "required_reputation_rules": []
        }
      ],
      "granted_skills": [
        {
          "skill_id": "archer_shooting_specialization",
          "unlock_rank": 1,
          "skill_type": "passive"
        }
      ],
      "attribute_modifiers": [],
      "active_conditions": [],
      "reactivation_mode": "auto",
      "dependency_visibility_mode": "count_when_hidden"
    },
    {
      "profession_id": "berserker",
      "display_name": "狂战士",
      "description": "围绕高压近战和范围破阵构建输出节奏的暴烈职业。",
      "max_rank": 5,
      "hit_die_sides": 12,
      "bab_progression": "full",
      "is_initial_profession": true,
      "unlock_knowledge_id": "",
      "unlock_requirement": {
        "required_skill_ids": [],
        "required_tag_rules": [
          {
            "tag": "berserker",
            "count": 2,
            "skill_state": "learned",
            "origin_filter": "unmerged_only",
            "selection_role": "qualifier"
          },
          {
            "tag": "berserker",
            "count": 1,
            "skill_state": "core_qualified",
            "origin_filter": "unmerged_only",
            "selection_role": "assigned_core"
          }
        ],
        "required_profession_ranks": [],
        "required_attribute_rules": [],
        "required_reputation_rules": [],
        "assigned_core_must_be_subset_of_qualifiers": true
      },
      "rank_requirements": [
        {
          "target_rank": 2,
          "required_tag_rules": [
            {
              "tag": "berserker",
              "count": 2,
              "skill_state": "core_qualified",
              "origin_filter": "unmerged_only",
              "selection_role": "assigned_core"
            }
          ],
          "required_profession_ranks": [],
          "required_attribute_rules": [],
          "required_reputation_rules": []
        },
        {
          "target_rank": 3,
          "required_tag_rules": [
            {
              "tag": "berserker",
              "count": 2,
              "skill_state": "core_qualified",
              "origin_filter": "unmerged_only",
              "selection_role": "assigned_core"
            }
          ],
          "required_profession_ranks": [],
          "required_attribute_rules": [],
          "required_reputation_rules": []
        },
        {
          "target_rank": 4,
          "required_tag_rules": [
            {
              "tag": "berserker",
              "count": 3,
              "skill_state": "core_qualified",
              "origin_filter": "unmerged_only",
              "selection_role": "assigned_core"
            }
          ],
          "required_profession_ranks": [],
          "required_attribute_rules": [],
          "required_reputation_rules": []
        },
        {
          "target_rank": 5,
          "required_tag_rules": [
            {
              "tag": "berserker",
              "count": 3,
              "skill_state": "core_qualified",
              "origin_filter": "unmerged_only",
              "selection_role": "assigned_core"
            }
          ],
          "required_profession_ranks": [],
          "required_attribute_rules": [],
          "required_reputation_rules": []
        }
      ],
      "granted_skills": [],
      "attribute_modifiers": [],
      "active_conditions": [],
      "reactivation_mode": "auto",
      "dependency_visibility_mode": "count_when_hidden"
    },
    {
      "profession_id": "mage",
      "display_name": "法师",
      "description": "以范围法术、元素压制和远距离点杀为核心的施法职业。",
      "max_rank": 5,
      "hit_die_sides": 6,
      "bab_progression": "half",
      "is_initial_profession": true,
      "unlock_knowledge_id": "",
      "unlock_requirement": {
        "required_skill_ids": [],
        "required_tag_rules": [
          {
            "tag": "mage",
            "count": 2,
            "skill_state": "learned",
            "origin_filter": "unmerged_only",
            "selection_role": "qualifier"
          },
          {
            "tag": "mage",
            "count": 1,
            "skill_state": "core_qualified",
            "origin_filter": "unmerged_only",
            "selection_role": "assigned_core"
          }
        ],
        "required_profession_ranks": [],
        "required_attribute_rules": [],
        "required_reputation_rules": [],
        "assigned_core_must_be_subset_of_qualifiers": true
      },
      "rank_requirements": [
        {
          "target_rank": 2,
          "required_tag_rules": [
            {
              "tag": "mage",
              "count": 2,
              "skill_state": "core_qualified",
              "origin_filter": "unmerged_only",
              "selection_role": "assigned_core"
            }
          ],
          "required_profession_ranks": [],
          "required_attribute_rules": [],
          "required_reputation_rules": []
        },
        {
          "target_rank": 3,
          "required_tag_rules": [
            {
              "tag": "mage",
              "count": 2,
              "skill_state": "core_qualified",
              "origin_filter": "unmerged_only",
              "selection_role": "assigned_core"
            }
          ],
          "required_profession_ranks": [],
          "required_attribute_rules": [],
          "required_reputation_rules": []
        },
        {
          "target_rank": 4,
          "required_tag_rules": [
            {
              "tag": "mage",
              "count": 3,
              "skill_state": "core_qualified",
              "origin_filter": "unmerged_only",
              "selection_role": "assigned_core"
            }
          ],
          "required_profession_ranks": [],
          "required_attribute_rules": [],
          "required_reputation_rules": []
        },
        {
          "target_rank": 5,
          "required_tag_rules": [
            {
              "tag": "mage",
              "count": 3,
              "skill_state": "core_qualified",
              "origin_filter": "unmerged_only",
              "selection_role": "assigned_core"
            }
          ],
          "required_profession_ranks": [],
          "required_attribute_rules": [],
          "required_reputation_rules": []
        }
      ],
      "granted_skills": [],
      "attribute_modifiers": [],
      "active_conditions": [],
      "reactivation_mode": "auto",
      "dependency_visibility_mode": "count_when_hidden"
    },
    {
      "profession_id": "paladin",
      "display_name": "圣武士",
      "description": "兼顾前线惩击、祝福与小范围保护能力的重装圣职职业。",
      "max_rank": 5,
      "hit_die_sides": 10,
      "bab_progression": "full",
      "is_initial_profession": true,
      "unlock_knowledge_id": "",
      "unlock_requirement": {
        "required_skill_ids": [],
        "required_tag_rules": [
          {
            "tag": "paladin",
            "count": 2,
            "skill_state": "learned",
            "origin_filter": "unmerged_only",
            "selection_role": "qualifier"
          },
          {
            "tag": "paladin",
            "count": 1,
            "skill_state": "core_qualified",